ΑΦΡΟΛΟΥΤΡΟ ΒΡΕΦΙΚΟ TOP TO TOE WASH 500 ML|Αποδεδειγμένα ασφαλές από την 1η μέρα. Το πρώτο μπανάκι του μωρού. Αποδεδειγμένα ασφαλές για την επιδερμίδα του νεογέννητου, από την πρώτη ημέρα. Καθαρίζει απαλά την επιδερμίδα και τα μαλλάκια του μωρού. Η σύνθεση ΟΧΙ ΠΙΑ ΔΑΚΡΥΑ® είναι τόσο απαλή για τα μάτια και την επιδερμίδα, όσο το αγνό νερό.|https://www.ab.gr/medias/sys_master/h23/h5c/8833628602398.jpg|7
ΒΡΕΦΙΚΟ ΣΑΜΠΟΥΑΝ REGULAR 750 ML|Απαλό για τα μάτια, όσο το αγνό νερό. Για απαλά μαλλιά. Η σύνθεση ΟΧΙ ΠΙΑ ΔΑΚΡΥΑ® είναι απαλή για τα μάτια. Αφήνει τα μαλλιά απαλά και με μια ξεχωριστή, βρεφική μυρωδιά φρεσκάδας. Ελεγμένο από οφθαλμίατρο.|https://www.ab.gr/medias/sys_master/hd9/h36/8831980568606.jpg|7
ΕΝΥΔΑΤΙΚΗ ΚΡΕΜΑ ΕΝΥΔΑΤΙΚΗ ΚΡΕΜΑ 150 ML|Ενυδατώνει και προστατεύει την βρεφική επιδερμίδα. Υποαλλεργική, με ουδέτερο pH, δοκιμασμένη από παιδιάτρους.|https://www.ab.gr/medias/sys_master/he3/h0b/8848064446494.jpg|7
ΚΡΕΜΑ ΠΑΙΔΙΚΗ ΦΡΟΥΤΟΚΡΕΜΑ ΜΕ 3 ΦΡΟΥΤΑ 300 GR|Η Φρουτόκρεμα ΝΟΥΝΟΥ 3 φρούτα, από σιτάλευρο, μπανάνα, μήλο, πορτοκαλί και γάλα, αποτελεί μία καλά ισορροπημένη συμπληρωματική τροφή για βρέφη μετά τον 6ο μήνα. Περιέχει απαραίτητες βιταμίνες και ιχνοστοιχεία σε ιδανικές αναλογίες που βοηθούν στη σωστή ανάπτυξη των βρεφών και των μικρών παιδιών. Περιέχει γλουτένη.|https://www.ab.gr/medias/sys_master/hd2/hff/8934890405918.jpg|7
ΠΑΙΔΙΚΕΣ ΦΡΥΓΑΝΙΕΣ  100 GR|Από τον 6ο μήνα. Από δημητριακά βιολογικής καλλιέργειας ολικής αλέσεως πολύτιμα για την υγεία. Εύπεπτη και μαλακή. Χωρίς χημική επεξεργασία ή συνθετικά λιπάσματα ταχείας αποδέσμευσης. Περιέχει βιταμίνη Β1 - σημαντική για τη σωστή λειτουργία του νευρικού συστήματος. Δεν περιέχει αυγό, αρώματα, χρωστικές ουσίες, συντηρητικά. Με ιδανικό σχήμα για να μπορεί το βρέφος να μαθαίνει να κρατά και να τρώει μόνο του κάτω από την επίβλεψη της μαμάς. Ιδανική για την περίοδο της οδοντοφυΐας.|https://www.ab.gr/medias/sys_master/h9b/hde/8840085504030.jpg|7
ΕΤΟΙΜΑ ΠΑΙΔΙΚΑ ΓΕΥΜΑΤΑ ΜΟΣΧΑΡΙ ΛΑΧΑΝΙΚΑ ΒΑΖΑΚΙ 250 GR|Τα βρεφικά γεύματα λαχανικών με κρέας σε γυάλινα βαζάκια της NESTLE παρασκευάζονται από 100% φυσικά συστατικά προσφέροντας ένα εξαιρετικά εύγεστο γεύμα στο μωρό σας!Μαγειρεύονται στον ατμό με έξτρα παρθένο ελαιόλαδο και σε συγκεκριμένη θερμοκρασία για να παραμείνουν όλα τα θρεπτικά συστατικά αναλλοίωτα! Έπειτα συσκευάζονται σε γυάλινα βαζάκια και σε κενό αέρος, ώστε να διατηρούνται άριστα χωρίς συντηρητικά!Σύμφωνα με την τρέχουσα νομοθεσία, απαγορεύεται η χρήση συντηρητικών στις βρεφικές τροφές.|https://www.ab.gr/medias/sys_master/h77/hd9/8850350735390.jpg|7
ΚΟΚΤΕΙΛ 4 ΦΡΟΥΤΑ ΒΑΖΟ 2Χ130 GR|Τα βαζάκια φρούτων NESTLE παρασκευάζονται από 100% φυσικά φρούτα και μόνο από αυστηρά ελενγμένες ποικιλίες.Δεν περιέχουν προσθήκη ζάχαρης ενώ είναι εμπλουτισμένα με βιταμίνη C.Επιπλέον, χάρη στην πρακτική τους γυάλινη συσκευασία με το αεροστεγές κλείσιμο,μπορείτε να έχετε το φρούτο του μωρού σας πάντα και παντού μαζί σας, καθώς δεν χρειάζονται ψυγείο πριν το άνοιγμα!Σύμφωνα με την τρέχουσα νομοθεσία, απαγορεύεται η χρήση συντηρητικών στις βρεφικές τροφές.|https://www.ab.gr/medias/sys_master/hdb/h9a/8850344640542.jpg|7
ΚΡΕΜΑ ΠΑΙΔΙΚΗ ΡΥΖΑΛΕΥΡΟ ΟΛΙΚΗΣ ΑΛΕΣΗΣ ΒΙΟΛΟΓΙΚΟ 200 GR|Το ρύζι ολικής άλεσης καλλιεργείται σε βιολογικούς ορυζώνες και αποτελεί μια αγνή και φυσική τροφή για τον απογαλακτισμό. Το ρυζάλευρο ολικής άλεσης bio-bebe είναι η ιδανική πρώτη τροφή απογαλακτισμού εξαιρετικά εύπεπτη, με λεία υφή, κατάλληλη για τη μικρή και ευαίσθητη βρεφική κοιλίτσα. Από τον 4ο μήνα και μετά.|https://www.ab.gr/medias/sys_master/hf6/h78/8833077968926.jpg|7
ΜΠΙΣΚΟΤΟΚΡΕΜΑ  350 GR|Η βρεφική κρέμα δημητριακών NESTLE ΜΠΙΣΚΟΤΟΚΡΕΜΑ σε πρακτική συσκευασία 350g περιέχει 7 ολόκληρα γεύματα για να καλύψει τις ανάγκες μίας εβδομάδας, ενώ παράλληλα προσφέρει στο μωρό σας: Πάνω απο το 50% της ημερήσιας πρόσληψης σε ΣΙΔΗΡΟ με 1 γεύμα! Ψευδάργυρο, βιταμίνες A & C που βοηθούν τη φυσιολογική λειτουργία του ανοσοποιητικού συστήματος.Ασβέστιο και πολλά άλλα θρεπτικά συστατικά απαραίτητα για την ανάπτυξή του μωρού σας 40% δημητριακά σε κάθε κουταλιάΥπέροχη γεύση και βελούδινη υφή|https://www.ab.gr/medias/sys_master/h0f/hbc/8841216098334.jpg|7
BABY OIL ALOE VERA 200 ML|Σφραγίζει 10 φορές περισσότερη υγρασία από ότι πολλές λοσιόν σε στεγνή επιδερμίδα. Για το μωρό και εσάς Δημιουργεί ένα λεπτό προστατευτικό φραγμό στην επιδερμίδα. Υποαλλεργικό* και δερματολογικά ελεγμένο. Εμπλουτισμένη με καταπραϋντική Aloe Vera.  (*Σχεδιασμένο να ελαχιστοποιεί τον κίνδυνο αλλεργιών. )|https://www.ab.gr/medias/sys_master/h20/h04/8839793344542.jpg|7
ΠΑΝΕΣ ΒΡΑΚΑΚΙΑ NΟΥΜΕΡΟ 4 (9-14ΚG) 16 ΤΕΜ||https://www.ab.gr/medias/sys_master/h95/ha3/8917454749726.jpg|7
ΠΑΝΕΣ ΒΡΑΚΑΚΙΑ SMALL 7 - 12 KGR 6 ΤΕΜ|Τα Libero Swimpants είναι πάνες-βρακάκια μαγιό! Οι πάνες Libero Swimpants είναι πάνες βρακάκι ειδικά σχεδιασμένες για χρήση μέσα στο νερό στην θάλασσα ή στην πισίνα. Μέγεθος small.|https://www.ab.gr/medias/sys_master/hfb/h71/8851336888350.jpg|7
ΦΡΟΥΤΟΓΕΥΜΑΤΑΚΙ ΚΟΚΤΕΙΛ 5 ΦΡΟΥΤΩΝ ΚΑΙ 3 ΔΗΜΗΤΡΙΑΚΩΝ 4 Χ 100 GR|Το ΦΡΟΥΤΟΓΕΥΜΑΤΑΚΙ NESTLE είναι ένας απολαυστικός πολτός 5 φρούτων (μήλο, ροδάκινο, βερίκοκο, αχλάδι, μπανάνα) με 3 δημητριακών (βρώμη, σιτάρι, ρύζι).Παρασκευάζεται από 100% φυσικά φρούτα και μόνο από αυστηρές ελεγμένες ποικιλίες.Δεν περιέχει προσθήκη ζάχαρης και είναι εμπλουτισμένο με βιταμίνη C, η οποία βοηθά στην καλύτερη απορρόφηση του σιδήρου από τον οργανισμό. Επιπλέον, η πρακτική του συσκευασία που δεν απαιτεί ψυγείο πριν το άνοιγμα, σας επιτρέπει να έχετε παντού κι έτοιμο το αλεσμένο φρούτο του μωρού σας τόσο στο σπίτι όσο και στη βόλτα ή στην εκδρομή!|https://www.ab.gr/medias/sys_master/he8/h89/8926565203998.jpg|7
ΕΤΟΙΜΑ ΠΑΙΔΙΚΑ ΓΕΥΜΑΤΑ ΚΟΤΟΠΟΥΛΟ ΡΥΖΙ ΛΑΧΑΝΙΚΑ ΒΑΖΑΚΙ 250 GR|Τα βρεφικά γεύματα λαχανικών με κρέας σε γυάλινα βαζάκια της NESTLE παρασκευάζονται από 100% φυσικά συστατικά προσφέροντας ένα εξαιρετικά εύγεστο γεύμα στο μωρό σας!Μαγειρεύονται στον ατμό με έξτρα παρθένο ελαιόλαδο και σε συγκεκριμένη θερμοκρασία για να παραμείνουν όλα τα θρεπτικά συστατικά αναλλοίωτα! Έπειτα συσκευάζονται σε γυάλινα βαζάκια και σε κενό αέρος, ώστε να διατηρούνται άριστα χωρίς συντηρητικά!Σύμφωνα με την τρέχουσα νομοθεσία, απαγορεύεται η χρήση συντηρητικών στις βρεφικές τροφές.|https://www.ab.gr/medias/sys_master/h2c/hc1/8839756775454.jpg|7
ΚΡΕΜΑ 7 ΔΗΜΗΤΡΙΑΚΑ 300 GR|Η Κρέμα 7 Δημητριακών ΝΟΥΝΟΥ, με μπανάνα και γάλα, αποτελεί μία καλά ισορροπημένη συμπληρωματική τροφή για βρέφη μετά τον 6ο μήνα. Περιέχει απαραίτητες βιταμίνες και ιχνοστοιχεία σε ιδανικές αναλογίες που βοηθούν στη σωστή ανάπτυξη των βρεφών και των μικρών παιδιών. Περιέχει γλουτένη. Μοναδική, μπανανένια και ΝΟΥΝΟΥ!|https://www.ab.gr/medias/sys_master/h44/h49/8934910394398.jpg|7
ΚΡΕΜΑ ΠΑΙΔΙΚΗ ΔΗΜΗΤΡΙΑΚΩΝ 300 GR|Δύναμη και ενέργεια... για τα πρώτα του βήματα. Tο μωράκι σας είναι έτοιμο για τα πρώτα του βηματάκια; Tότε χρειάζεται τη νέα Kρέμα Δημητριακών ΓIΩTHΣ. Mια κρέμα με 6 διαλεγμένα δημητριακά και γάλα, που θα του δώσει όλη την απαιτούμενη ενέργεια και δύναμη για ένα δυναμικό ξεκίνημα.|https://www.ab.gr/medias/sys_master/h71/h72/8839178354718.jpg|7
ΚΡΕΜΑ ΠΑΙΔΙΚΗ ΦΑΡΙΝ ΛΑΚΤΕ 300 GR|Aγνή, ξεχωριστή, πλούσια... σαν το πρώτο του χαμόγελο. H βασική κρέμα του μωρού σας με γάλα και άλευρο σίτου. H Φαρίν Λακτέ ΓIΩTHΣ είναι μια κρέμα πλούσια σε πρωτεΐνες, βιταμίνες και μεταλλικά άλατα. Δίνει στον οργανισμό του μωρού σας όλα τα απαραίτητα θρεπτικά συστατικά για τη σωστή του ανάπτυξη.|https://www.ab.gr/medias/sys_master/h17/h90/8838191939614.jpg|7
ΜΩΡΟΜΑΝΤΗΛΑ ΑΝΤΑΛΛΑΚΤΙΚΟ 72 ΤΕΜ|Οι μωροπετσέτες Babycare Χαμομήλι σχεδιάστηκαν για τον απαλό, καθημερινό καθαρισμό του βρεφικού δέρματος. Με εκχύλισμα χαμομηλιού, καθαρίζουν απαλά, περιποιούνται το βρεφικό δέρμα και συμβάλλουν στην προστασία από ερεθισμούς και συγκάματα.|https://www.ab.gr/medias/sys_master/h8c/hac/8837324800030.jpg|7
ΦΡΟΥΤΟΓΕΥΜΑΤΑΚΙ ΜΠΑΝΑΝΑ ΜΗΛΟ ΠΟΡΤΟΚΑΛΙ ΒΑΖΑΚΙ 2 Χ 130 GR|Τα βαζάκια φρούτων NESTLE παρασκευάζονται από 100% φυσικά φρούτα και μόνο από αυστηρά ελενγμένες ποικιλίες.Δεν περιέχουν προσθήκη ζάχαρης ενώ είναι εμπλουτισμένα με βιταμίνη C.Επιπλέον, χάρη στην πρακτική τους γυάλινη συσκευασία με το αεροστεγές κλείσιμο,μπορείτε να έχετε το φρούτο του μωρού σας πάντα και παντού μαζί σας, καθώς δεν χρειάζονται ψυγείο πριν το άνοιγμα!Σύμφωνα με την τρέχουσα νομοθεσία, απαγορεύεται η χρήση συντηρητικών στις βρεφικές τροφές.|https://www.ab.gr/medias/sys_master/h6e/hcf/8850356830238.jpg|7
ΒΡΕΦΙΚΗ ΚΡΕΜΑ ΣΥΓΚΑΜΑΤΟΣ  100 ML|Η Πλούσια Κρέμα Εντατικής Προστασίας της σειράς Baby Moments, είναι σχεδιασμένη να προστατεύει τη βρεφική επιδερμίδα και να προλαμβάνει τους ερεθισμούς που προκαλούνται από την πάνα. Το συστατικό zinc oxide (10%) δημιουργεί ένα προστατευτικό στρώμα που επιτρέπει στην επιδερμίδα να αναπνέει και σε συνδυασμό με το συστατικό panthenol βοηθά στην αναζωογόνηση της.|https://www.ab.gr/medias/sys_master/hec/h6d/8917306245150.jpg|7
ΓΑΛΑ ΒΡΕΦΙΚΟ ΣΕ ΣΚΟΝΗ ΔΕΥΤΕΡΗΣ ΒΡΕΦΙΚΗΣ ΗΛΙΚΙΑΣ 400 GR|Γάλα 2ης βρεφικής ηλικίας για βρέφη από τον 6ο μήνα και μετά, στιγμιαίας παρασκευής, με νέα προηγμένη σύνθεση.  Το frisomel περιέχει απαραίτητες βιταμίνες, ιχνοστοιχεία και λιπαρά οξέα για την υγιή ανάπτυξη των βρεφών και  κάλυπτει τις ειδικές διατροφικές τους αναγκές. Είναι πηγή ασβεστίου και φωσφόρου και φυσικά πλούσιο σε βιταμίνη D  τα οποία είναι απαράιτητα για υγιή ανάπτυξη των οστών, καθώς και πηγη σε σίδηρο, ο οποίος συμβάλλει στη φυσιολογική γνωσιακή ανάπτυξη των βρεφών.|https://www.ab.gr/medias/sys_master/h1e/h57/8918415114270.jpg|7
ΠΑΝΕΣ ΜΩΡΟΥ SENSITIVE 4 - 9 KGR No 3 22 ΤΕΜ|Είναι η κατάλληλη περίοδος για βόλτες εκτός σπιτιού, εκδρομές και επισκέψεις σε φίλους. Θα βοηθήσουν πολύ το μικρό σας να αναπτύξει την κοινωνικότητά του και να μάθει να προσαρμόζεται σε οποιοδήποτε περιβάλλον, κάτι που θα του φανεί πολύ χρήσιμο στην υπόλοιπη ζωή του.  Επιπλέον, τα φιλικά υλικά τους, πιστοποιημένα βάσει Oeko-Tex® Standard 100, το αγγίζουν απαλά και του προσφέρουν sensitive προστασία και φροντίδα.|https://www.ab.gr/medias/sys_master/he1/h3b/8923014496286.jpg|7
ΒΡΕΦΙΚΗ ΠΟΥΔΡΑ ΣΩΜΑΤΟΣ  200 GR|Κλινικά ελγμένη απαλότητα. Για επιπλέον άνεση, βοηθά στην προστασία της επιδερμίδας από την τριβή και τους ερεθισμού και διατηρεί την επιδερμίδα απαλή και υγιή.|https://www.ab.gr/medias/sys_master/ha2/h12/8831954026526.jpg|7
ΓΑΛΑ ΕΒΑΠΟΡΕ NOULAC  PREBIOTIC 6 X 400 GR||https://www.ab.gr/medias/sys_master/h62/h2d/8934924419102.jpg|7
ΕΤΟΙΜΑ ΠΑΙΔΙΚΑ ΓΕΥΜΑΤΑ ΛΑΧΑΝΙΚΑ ΜΕ ΚΟΤΟΠΟΥΛΟ ΒΑΖΑΚΙ 250 GR|Τα βρεφικά γεύματα λαχανικών με κρέας σε γυάλινα βαζάκια της NESTLE παρασκευάζονται από 100% φυσικά συστατικά προσφέροντας ένα εξαιρετικά εύγεστο γεύμα στο μωρό σας!Μαγειρεύονται στον ατμό με έξτρα παρθένο ελαιόλαδο και σε συγκεκριμένη θερμοκρασία για να παραμείνουν όλα τα θρεπτικά συστατικά αναλλοίωτα! Έπειτα συσκευάζονται σε γυάλινα βαζάκια και σε κενό αέρος, ώστε να διατηρούνται άριστα χωρίς συντηρητικά!Σύμφωνα με την τρέχουσα νομοθεσία, απαγορεύεται η χρήση συντηρητικών στις βρεφικές τροφές.|https://www.ab.gr/medias/sys_master/h73/h1e/8839755989022.jpg|7
ΚΡΕΜΑ ΜΑΛΛΙΩΝ ΧΩΡΙΣ ΚΟΜΠΟΥΣ 500 ML||https://www.ab.gr/medias/sys_master/hf0/h54/8920456495134.jpg|7
ΠΑΝΕΣ PREMIUM CARE NΟΥΜΕΡΟ 3 (5-9 KG) 20 ΤΕΜ||https://www.ab.gr/medias/sys_master/h9c/h7d/8917303754782.jpg|7
ΠΑΝΕΣ PREMIUM CARE NΟΥΜΕΡΟ 4 (8-14 KG) 34 ΤΕΜ||https://www.ab.gr/medias/sys_master/haf/he9/8917446688798.jpg|7
ΠΑΝΕΣ PREMIUM CARE ΝΟΥΜΕΡΟ 2 (3-6 KG) 20 TEM||https://www.ab.gr/medias/sys_master/hb1/hd2/8918142320670.jpg|7
ΡΥΖΑΛΕΥΡΟ ΒΑΝΙΛΙΑ 350 GR|Η βρεφική κρέμα δημητριακών Nestlé Βρεφική Κρέμα Ρυζάλευρο Βανίλια σε πρακτική συσκευασία 350g περιέχει 7 ολόκληρα γεύματα για να καλύψει τις ανάγκες μίας εβδομάδας, ενώ παράλληλα προσφέρει στο μωρό σας:Πάνω απο το 50% της ημερήσιας πρόσληψης σε ΣΙΔΗΡΟ με 1 γεύμα!Βιταμίνη C που βοηθάει στην απορρόφηση του σιδήρουΨευδάργυρο, βιταμίνες A & C που βοηθούν τη φυσιολογική λειτουργία του ανοσοποιητικού συστήματος.Ασβέστιο και πολλά άλλα θρεπτικά συστατικά απαραίτητα για την ανάπτυξή του μωρού σας54% δημητριακά σε κάθε κουταλιάΥπέροχη γεύση και βελούδινη υφήΧωρίς γλουτένη|https://www.ab.gr/medias/sys_master/h68/h31/8841169698846.jpg|7
ΣΑΜΠΟΥΑΝ SHINY DROPS 500 ML|Για ενισχυμένη λάμψη και απαλά, μεταξένια μαλλιά. Με τη μοναδική σύνθεση ΟΧΙ ΠΙΑ ΔΑΚΡΥΑ. Περιέχει μια νότα από πρωτεΐνες μεταξιού και μια σταγόνα ελαίου argan. Ιδανικό για καθημερινή χρήση.|https://www.ab.gr/medias/sys_master/h67/h78/8848630841374.jpg|7
ΣΑΜΠΟΥΑΝ ΧΩΡΙΣ ΚΟΜΠΟΥΣ 500 ML||https://www.ab.gr/medias/sys_master/h6d/h1b/8921263374366.jpg|7
ΓΑΛΑ ΒΡΕΦΙΚΟ ΣΕ ΣΚΟΝΗ ΓΙΑ ΝΗΠΙΑ ΑΠΟ 1+ ΕΤΩΝ 800 GR|Κατά την περίοδο 1-2 ετών τα νήπια παρουσιάζουν αυξημένη σωματική και διανοητική ανάπτυξη. Τo Almiron Growing Up είναι γάλα ειδικά μελετημένο για να καλύπτει τις ανάγκες μιας διαφοροποιημένης και ισορροπημένης διατροφής και αποτελεί την κατάλληλη επιλογή για εσάς που θέλετε το καλύτερο για το παιδί σας.|https://www.ab.gr/medias/sys_master/hb6/h6a/8918412296222.jpg|7
ΓΑΛΑ ΒΡΕΦΙΚΟ ΣΕ ΣΚΟΝΗ ΔΕΥΤΕΡΗΣ ΒΡΕΦΙΚΗΣ ΗΛΙΚΙΑΣ 800 GR|Το Almiron 2 είναι γάλα 2ης βρεφικής ηλικίας για υγιή βρέφη από 6 μηνών.  Η σύνθεση του είναι ειδικά μελετημένη ώστε να ανταποκρίνεται στις συγκεκριμένες διατροφικές ανάγκες του δεύτερου εξαμήνου της ζωής του βρέφους οι οποίες διαφέρουν από αυτές των πέντε πρώτων μηνών.|https://www.ab.gr/medias/sys_master/h6d/h75/8941337018398.jpg|7
ΚΡΕΜΑ ΜΑΛΛΙΩΝ SHINY DROPS 500ML||https://www.ab.gr/medias/sys_master/hc3/h81/8920382570526.jpg|7
ΜΩΡΟΜΑΝΤΗΛΑ SENSITIVE 72 ΤΕΜ|Μωρομάντηλα με εκχυλίσματα αμυγδάλου και ενυδατικού γάλακτος. Για ευαίσθητες επιδερμίδες.|https://www.ab.gr/medias/sys_master/h92/hdc/8830155554846.jpg|7
ΠΑΙΔΙΚΗ ΚΡΕΜΑ ΦΑΡΙΝ ΛΑΚΤΕ ΜΗΛΟ ΚΑΙ ΑΧΛΑΔΙ 300 GR|Η Φαρίν Λακτέ με μήλο και αχλάδι ΓΙΩΤΗΣ είναι μια νέα βρεφική κρέμα που έρχεται να προστεθεί στη σειρά των βρεφικών κρεμών ΓΙΩΤΗΣ, με σιτάλευρο, γάλα και 2 φρούτα (μήλο και αχλάδι). Ιδιαίτερα εύγεστη και θρεπτική.|https://www.ab.gr/medias/sys_master/h72/hb6/8835930357790.jpg|7
ΣΑΜΠΟΥΑΝ ΚΑΙ ΑΦΡΟΛΟΥΤΡΟ ΠΑΙΔΙΚΟ ΜΕ ΛΕΒΑΝΤΑ 500 ML|"<p>Το σαμπουάν & αφρόλουτρο SEPTONA Calm n' Care με βάλσαμο και λεβάντα, χάρη στην ήπια σύνθεσή του με φυσικούς ενυδατικούς παράγοντες, καθαρίζει απαλά χωρίς να ξηραίνει τα μαλλιά και την επιδερμίδα του μωρού σας, αφήνοντας χαλαρωτικό άρωμα που το βοηθάει να κοιμάται καλύτερα! Δεν προκαλεί δάκρυα-Καθαρίζει απαλά, μαλλιά και επιδερμίδα-Ιδανικό για καθημερινή χρήση.</p>
