ΜΩΡΟΜΑΝΤΗΛΑ ΑΝΤΑΛΛΑΚΤΙΚΟ 3 Χ 72 ΤΕΜ|Οι μωροπετσέτες Babycare Χαμομήλι σχεδιάστηκαν για τον απαλό, καθημερινό καθαρισμό του βρεφικού δέρματος. Με εκχύλισμα χαμομηλιού, καθαρίζουν απαλά, περιποιούνται το βρεφικό δέρμα και συμβάλλουν στην προστασία από ερεθισμούς και συγκάματα.|https://www.ab.gr/medias/sys_master/hce/h02/8838327074846.jpg|7
ΜΩΡΟΜΑΝΤΗΛΑ ΑΝΤΑΛΛΑΚΤΙΚΟ 80 ΤΕΜ|Υγρά μωρομάντηλα από την 365 απαλά και ανθεκτικά, ιδανικά για τον καθημερινό καθαρισμό καθαρισμό των μωρών. Είναι εμποτισμένα με καθαριστική λοσιόν χωρίς αλκοόλ. Είναι πλούσιο σε εκχύλισμα χαμομηλιού και προβιταμίνη Β5. Χωρίς parabens.|https://www.ab.gr/medias/sys_master/hc8/h36/8836291788830.jpg|7
ΜΩΡΟΜΑΝΤΗΛΑ SENSITIVE 168 ΤΕΜ 2 + 1 ΔΩΡΟ|Απαλή καθαριότητα για ευαίσθητες επιδερμίδες. Απαλή φροντίδα για το μικρό σας πλασματάκι. Για αυτόν το λόγο, τα μωρομάντηλα Pampers Sensitive διαθέτουν τη μοναδική Απαλή Ανάγλυφη Υφή των Pampers που προσφέρει απαλή καθαριότητα στις ευαίσθητες επιδερμίδες. Η επιδερμίδα του μωρού σας είναι ευαίσθητη. Γι' αυτό και τα μωρομάντηλα Pampers Sensitive είναι δερματολογικά ελεγμένα ως προς την απαλότητά τους. Είναι 15% πιο πυκνά και αποκαθιστούν το φυσικό pH της επιδερμίδας για να προστατεύουν το ευαίσθητο δερματάκι του μωρού σας.|https://www.ab.gr/medias/sys_master/hea/h82/8838304071710.jpg|7
ΜΩΡΟΜΑΝΤΗΛΑ GENTLE CLEANS 112 TEM|Στην Johnsons Baby καταλαβαίνουν ότι η ευαίσθητη επιδερμίδα των μωρών χρειάζεται ειδική περιποίηση, από την κορυφή ως τα νύχια. Γι’ αυτό, τα μωρομάντηλα JOHNSON’S Baby Gentle Cleansing περιέχουν τη μοναδική σύνθεση ΟΧΙ ΠΙΑ ΔΑΚΡΥΑ, απαλή ενυδατική βρεφική λοσιόν με 97% αγνό νερό, ώστε να είναι ήπια και απαλά, και να μπορούν να χρησιμοποιηθούν σε όλο το σώμα, ακόμα και γύρω από τα μάτια. Κλινικά αποδεδειγμένα απαλά. Χωρίς σαπούνι - χωρίς οινόπνευμα.|https://www.ab.gr/medias/sys_master/h75/h0b/8839198408734.jpg|7
ΜΩΡΟΜΑΝΤΗΛΑ SENSITIVE 56 ΤΕΜ|Απαλή φροντίδα για το μικρό σας πλασματάκι. Για αυτόν το λόγο, τα μωρομάντηλα Pampers Sensitive διαθέτουν τη μοναδική Απαλή Ανάγλυφη Υφή των Pampers που προσφέρει απαλή καθαριότητα στις ευαίσθητες επιδερμίδες. Η επιδερμίδα του μωρού σας είναι ευαίσθητη. Γι' αυτό και τα μωρομάντηλα Pampers Sensitive είναι δερματολογικά ελεγμένα ως προς την απαλότητά τους.|https://www.ab.gr/medias/sys_master/hbc/h25/8855078010910.jpg|7
ΜΩΡΟΜΑΝΤΗΛΑ FRESH CLEAN 192 TEM 2+1 ΔΩΡΟ|Μαλακά και ανθεκτικά για απαλή καθαριότητα. Απαλή καθαριότητα για το μικρό σας πλασματάκι. Χάρη στη μοναδική Απαλή Ανάγλυφη Υφή τα μωρομάντηλα Pampers Fresh Clean είναι μαλακά και ανθεκτικά, ώστε να προσφέρουν απαλή καθαριότητα στην ευαίσθητη επιδερμίδα του μωρού σας. Περιέχουν ένα άρωμα φρεσκάδας και είναι δερματολογικά ελεγμένα ως προς την απαλότητά τους. Επίσης, αποκαθιστούν το φυσικό pH της επιδερμίδας του μωρού σας.|https://www.ab.gr/medias/sys_master/h86/h0e/8927422414878.jpg|7
ΓΙΑΟΥΡΤΙ ΠΑΙΔΙΚΟ ΔΗΜΗΤΡIAKA 2 Χ 150 GR|Τα πρώτα ειδικά μελετημένα και κατάλληλα εμπλουτισμένα για μωρά από 6 μηνών.|https://www.ab.gr/medias/sys_master/h49/h66/8834741207070.jpg|7
ΜΩΡΟΜΑΝΤΗΛΑ PANTHENOL GIGA PACK 75 TΕΜ|"<p>Τα απαλά μωρομάντηλα SEPTONA Calm n' Care Panthenol είναι ιδανικά για την καθημερινή περιποίηση της ευαίσθητης βρεφικής επιδερμίδας, από την 1η μέρα. Η αγνή σύνθεσή τους με πανθενόλη καθαρίζει απαλά το δερματάκι του μωρού σας, προσφέροντας ταυτόχρονα λιγότερους ερεθισμούς από το σύγκαμα. Φυσικό pH 5,5. Δερματολογικά ελεγμένα. 0% παραβένες, αλλεργιογόνα, οινόπνευμα, σαπούνι, προπυλενογλυκόλη, ισοθειαζολινόνες.</p>
