"|https://www.ab.gr/medias/sys_master/hbd/hd9/8941204111390.jpg|7
BABY OIL REGULAR 200 ML|Σφραγίζει 10 φορές περισσότερη υγρασία από ότι πολλές λοσιόν σε στεγνή επιδερμίδα. Για το μωρό και εσάς. Δημιουργεί ένα λεπτό προστατευτικό φραγμό στην επιδερμίδα. Υποαλλεργικό* και δερματολογικά ελεγμένο.Ιδανικό για μασάζ στο μωρό. (*Σχεδιασμένο να ελαχιστοποιεί τον κίνδυνο αλλεργιών. )|https://www.ab.gr/medias/sys_master/hbf/hc2/8831982731294.jpg|7
NESTLE OPTIPRO 1 ΓΑΛΑ ΠΡΩΤΗΣ ΒΡΕΦΙΚΗΣ ΗΛΙΚΙΑΣ  400 GR|Το NAN OPTIPRO 1 είναι ένα βρεφικό  γάλα για υγιή βρέφη όταν δεν θηλάζουν αποκλειστικά το NAN OPTIPRO 1 προσφέρει στο μωρό σου όλα τα απαραίτητα θρεπτικά συστατικά για τη σωστή σωματική και πνευματική του ανάπτυξη. OPTIPRO ένα  μοναδικό μίγμα πρωτεϊνών, που προσφέρει την απαραίτητη ποσότητα  και ποιότητα πρωτεϊνών για τη σωστή ανάπτυξη του παιδιού.-Ενεργείς καλλιέργειες Bifidus BL που φυσιολογικά υπάρχουν στο μητρικό γάλα και στην εντερική χλωρίδα των βρεφών.-Πολύτιμα λιπαρά DHA-ARA, δύο απαραίτητα λιπαρά οξέα που βρίσκονται και στο μητρικό γάλα.ΣΗΜΑΝΤΙΚΗ ΥΠΕΝΘΥΜΙΣΗ: Το μητρικό γάλα είναι η ιδανική τρόφη για τα βρέφη και ο μητρικός θηλασμός πρέπει να συνεχίζεται όσο το δυνατόν περισσότερο. Πριν αποφασίσετε να χρησιμοποιήσετε ένα βρεφικό γάλα, ζητήστε τη συμβουλή του παιδιάτρου.|https://www.ab.gr/medias/sys_master/h83/h81/8875687510046.jpg|7
ΑΦΡΟΛΟΥΤΡΟ ΒΡΕΦΙΚΟ SOFT 500 ML|Ανακαλύψτε ξανά την αυθεντική βρεφική απαλότητα. Για πιο απαλό μπάνιο. Εμπλουτισμένο με ενυδατική baby lotion. Η σύνθεση ΟΧΙ ΠΙΑ ΔΑΚΡΥΑ® είναι απαλή για τα μάτια. Ξεχωριστή, βρεφική μυρωδιά φρεσκάδας.|https://www.ab.gr/medias/sys_master/h5d/h93/8832074940446.jpg|7
ΓΑΛΑ ΒΡΕΦΙΚΟ ΣΕ ΣΚΟΝΗ ΤΡΙΤΗΣ ΒΡΕΦΙΚΗΣ ΗΛΙΚΙΑΣ 350 GR|Το Nativa 3 είναι ένα γάλα, ειδικά μελετημένο για βρέφη άνω των 10 μηνών. Χάρη στο Gentle Grow, το Nativa 3 προσφέρει την απαραίτητη ποσότητα πρωτεϊνών και όλα τα απαραίτητα θρεπτικά συστατικά για την κάλυψη των διατροφικών αναγκών ενός βρέφους αυτής της ηλικίας. Το Nativa 3 περιέχει ενεργείς καλλιέργειες L. Comfortis.|https://www.ab.gr/medias/sys_master/h03/h20/8918432350238.jpg|7
ΓΑΛΑ ΜΑΚΡΑΣ ΔΙΑΡΚΕΙΑΣ ΓΙΑ ΝΗΠΙΑ  ΑΠΟ 1+ ΕΤΩΝ 1 LT|Κατά την περίοδο 1-2 ετών τα νήπια παρουσιάζουν αυξημένη σωματική και διανοητική ανάπτυξη. Τo Almiron Growing Up είναι γάλα ειδικά μελετημένο για να καλύπτει τις ανάγκες μιας διαφοροποιημένης και ισορροπημένης διατροφής και αποτελεί την κατάλληλη επιλογή για εσάς που θέλετε το καλύτερο για το παιδί σας.|https://www.ab.gr/medias/sys_master/h27/ha8/8918422847518.jpg|7
ΕΠΙΔΟΡΠΙΟ ΓΑΛΑΚΤΟΣ ΜΠΙΣΚΟΤΙΝΟ 4Χ100 GR|Τα ΕΠΙΔΟΡΠΙΑ ΓΑΛΑΚΤΟΣ NESTLE NESLAC έχουν απίθανη γεύση που λατρεύουν τα μωράκια, ενώ αποτελούνται από απολαυστικό γάλα υψηλής διατροφικής αξίας. Κάθε κυπελλάκι 100g καλύπτει  το 37,5% των ημερήσιων αναγκών σε: Ασβέστιο και Μαγνήσιο, για τη φυσιολογική ανάπτυξη των οστών του μωρού.          Ψευδάργυρο για την φυσιολογική ανάπτυξη.Επιπλέον, η πρακτική τους συσκευασία βοηθάει στο να τα έχεις παντού μαζί, ανά πάσα ώρα της ημέρας, καθώς δεν χρειάζονται ψυγείο!|https://www.ab.gr/medias/sys_master/hec/h4c/8926566449182.jpg|7
ΚΡΕΜΑ ΠΑΙΔΙΚΗ ΦΑΡΙΝ ΛΑΚΤΕ ΜΠΙΣΚΟΤΟ 300 GR|Η Φαρίν Λακτέ με Μπισκότα ΓΙΩΤΗΣ  είναι μια νέα βρεφική κρέμα που έρχεται να προστεθεί στη σειρά των βρεφικών κρεμών ΓΙΩΤΗΣ. Με σιτάλευρο, γάλα και μπισκότα, είναι ιδιαίτερα γευστική και θρεπτική και περιέχει τις απαραίτητες βιταμίνες, πρωτεΐνες και μεταλλικά άλατα για τη σωστή ανάπτυξη του βρέφους.|https://www.ab.gr/medias/sys_master/h17/hcf/8835875307550.jpg|7
ΠΑΝΕΣ ACTIVE BABY DRY ΝΟΥΜΕΡΟ 2 (3-6 KG) 22 TΕΜ||https://www.ab.gr/medias/sys_master/hf9/h3e/8917414772766.jpg|7
ΠΟΥΡΕΣ ΦΡΟΥΤΩΝ  200 GR|Οι αυστηροί έλεγχοι των πρώτων υλών, των διαδικασιών που ακολουθούνται και του τελικού προϊόντος, εγγυώνται την ποιότητα των προϊόντων βάση αυστηρών προδιαγραφών. Μεταξύ άλλων, εφαρμόζεται το HACCP σύστημα ελέγχου ποιότητας για όλες τις γραμμές παραγωγής, που αφορά στην ασφάλεια και στην υγιεινή των βιολογικών γευμάτων bio-bebe. Χωρίς τεχνητά αρώματα, χρωστικές ή συντηρητικά. Προϊόν ελεύθερο γλουτένης.|https://www.ab.gr/medias/sys_master/h96/h5a/8848058744862.jpg|7
ΒΡΕΦΙΚΟ ΣΑΜΠΟΥΑΝ BABY 400 ML|Βρεφικό σαμπουάν Baby.|https://www.ab.gr/medias/sys_master/hef/h36/8828766093342.jpg|7
ΓΑΛΑ ΒΡΕΦΙΚΟ ΣΕ ΣΚΟΝΗ ΔΕΥΤΕΡΗΣ ΒΡΕΦΙΚΗΣ ΗΛΙΚΙΑΣ 800 GR|Το Aptamil 2 της Milupa είναι γάλα σε σκόνη για βρέφη από τον 6ο μήνα. Συμβάλλει στην άριστη και υγιή ανάπτυξη του βρέφους με τη σύνθεση Ολοκληρωμένη Φροντίδα που εξασφαλίζει: Ασβέστιο & βιταμίνη D Ασβέστιο & βιταμίνη D για την ανάπτυξη των οστών. Ω3 λιπαρά οξέαΩ3 λιπαρά οξέα για την ανάπτυξη του εγκεφάλου και του νευρικού συστήματος. Πρεβιοτικές ίνες|https://www.ab.gr/medias/sys_master/h07/h55/8829018538014.jpg|7
ΓΑΛΑ ΒΡΕΦΙΚΟ ΣΕ ΣΚΟΝΗ ΠΡΩΤΗΣ ΒΡΕΦΙΚΗΣ ΗΛΙΚΙΑΣ 400 GR|Ρόφημα γάλακτος σε σκόνη για βρέφη, στιγμιαίας παρασκευής, με νέα προηγμένη σύνθεση.  Το frisolac περιέχει βιταμίνες, αμινοξέα, ιχνοστοιχεία και λιπαρά οξέα για την υγιή ανάπτυξη των βρεφών και  κάλυπτει τις ειδικές διατροφικές τους αναγκές. Το Fisolac έχει αναλογία ορού προς καζεΐνη 1,5.|https://www.ab.gr/medias/sys_master/h4a/h23/8836021583902.jpg|7
ΓΑΛΑ ΒΡΕΦΙΚΟ ΣΕ ΣΚΟΝΗ ΠΡΩΤΗΣ ΒΡΕΦΙΚΗΣ ΗΛΙΚΙΑΣ 400 GR|"Το βιοlac 1 είναι βρεφικό γάλα υψηλής βιολογικής ποιότητας που ανταποκρίνεται πλήρως στις διατροφικές ανάγκες του βρέφους από τη γέννησή του μέχρι τον 6ο μήνα. Χωρίς ""χημικά"" λιπάσματα και φυτοφάρμακα. Χωρίς ορμόνες, αντιβιοτικά και άλλους παράγοντες ανάπτυξης. Χωρίς χρήση γενετικά τροποποιημένων οργανισμών."|https://www.ab.gr/medias/sys_master/hd9/h37/8834995486750.jpg|7
ΜΩΡΟΜΑΝΤΗΛΑ ΧΑΜΟΜΗΛΙ 72 ΤΕΜ|Μωρομάντηλα με εκχυλίσματα χαμομηλιού.|https://www.ab.gr/medias/sys_master/h78/h33/8834764013598.jpg|7
ΠΑΝΕΣ ACTIVE BABY DRY NΟΥΜΕΡΟ 3 (5-9 KG) 20 ΤΕΜ||https://www.ab.gr/medias/sys_master/hcd/h26/8917433188382.jpg|7
ΒΡΕΦΙΚΟ ΓΕΥΜΑ ΜΟΣΧΑΡΑΚΙ ΜΕ ΛΑΧΑΝΙΚΑ 200 GR|Οι αυστηροί έλεγχοι των πρώτων υλών, των διαδικασιών που ακολουθούνται και του τελικού προϊόντος, εγγυώνται την ποιότητα των προϊόντων βάση αυστηρών προδιαγραφών. Μεταξύ άλλων, εφαρμόζεται το HACCP σύστημα ελέγχου ποιότητας για όλες τις γραμμές παραγωγής, που αφορά στην ασφάλεια και στην υγιεινή των βιολογικών γευμάτων bio-bebe. Χωρίς τεχνητά αρώματα, χρωστικές ή συντηρητικά. Προϊόν ελεύθερο γλουτένης.|https://www.ab.gr/medias/sys_master/h87/h57/8848056582174.jpg|7
ΒΡΕΦΙΚΟ ΣΑΜΠΟΥΑΝ JOHNSON 500 ML||https://www.ab.gr/medias/sys_master/he9/h86/8903731380254.jpg|7
ΓΑΛΑ ΒΡΕΦΙΚΟ ΣΕ ΣΚΟΝΗ ΔΕΥΤΕΡΗΣ ΒΡΕΦΙΚΗΣ ΗΛΙΚΙΑΣ BIOΛΟΓΙΚΟ 400 GR|Το βιοlac 2 είναι βρεφικό βιολογικό γάλα υψηλής διατροφικής αξίας, ειδικά μελετημένο ώστε να ανταποκρίνεται στις διατροφικές ανάγκες του βρέφους από τον 6ο μέχρι το 12o μήνα. Χωρίς «χημικά» λιπάσματα και φυτοφάρμακα. Χωρίς ορμόνες, αντιβιοτικά και άλλους παράγοντες ανάπτυξης. Χωρίς χρήση γενετικά τροποποιημένων οργανισμών.|https://www.ab.gr/medias/sys_master/hd7/h7e/8814336901150.jpg|7
ΓΑΛΑ ΒΡΕΦΙΚΟ ΣΕ ΣΚΟΝΗ ΤΡΙΤΗΣ ΒΡΕΦΙΚΗΣ ΗΛΙΚΙΑΣ 800 GR|Το Almiron 3 είναι γάλα 2ης βρεφικής ηλικίας για υγιή βρέφη από 10 μηνών. Η σύνθεσή του είναι μελετημένη ώστε να αποτελεί μια πλήρη, θρεπτική και ισορροπημένη πρόταση ανταποκρινόμενη στις διαφοροποιημένες πλέον διατροφικές ανάγκες της συγκεκριμένης ηλικίας.|https://www.ab.gr/medias/sys_master/hbb/hee/8941507510302.jpg|7
ΚΡΕΜΑ ΠΑΙΔΙΚΗ ΠΟΛΥΔΗΜΗΤΡΙΑΚΑ 300 GR|Τώρα που το μωρό σας έγινε 8 μηνών χρειάζεται πιο σύνθετα συστατικά. Αυτή την περίοδο το μωρό σας χρειάζεται τροφές με ακόμα μεγαλύτερη θρεπτική αξία, πιο σύνθετα συστατικά και πιο πλούσια υφή. Εισάγετε στο διαιτολόγιο του μωρού σας τη Nutricia Πολύ-δημητριακά από 8 μηνών, ειδικά μελετημένη για να καλύπτει τις διατροφικές ανάγκες του στο στάδιο αυτό, με πιο πλούσια και σύνθετη γεύση συνδυάζοντας 7 δημητριακά.|https://www.ab.gr/medias/sys_master/he9/h03/8910700281886.jpg|7
ΚΡΕΜΑ ΠΑΙΔΙΚΗ ΦΑΡΙΝ ΛΑΚΤΕ 300 GR|Τώρα που το μωρό σας έγινε 6 μηνών χρειάζεται περισσότερη ποικιλία! Καθώς το μωρό σας μεγαλώνει είναι σημαντικό να προσθέτετε στη διατροφή του ποικιλία τροφών και γεύσεων. Με αυτό τον τρόπο μαθαίνει από μικρό την ποικιλία, που αποτελεί θεμέλιο για μια ισορροπημένη διατροφή. Οι βρεφικές κρέμες Nutricia από 6 μηνών είναι ειδικά μελετημένες για να καλύπτουν τις διατροφικές ανάγκες του μωρού σας στο στάδιο αυτό, έτσι ώστε να εξοικειώνεται με νέες γεύσεις.|https://www.ab.gr/medias/sys_master/hef/ha4/8835030482974.jpg|7
ΦΡΟΥΤΟΓΕΥΜΑΤΑΚΙ ΚΟΚΤΕΪΛ 5 ΦΡΟΥΤΩΝ ΒΑΖΑΚΙ 4 Χ 100 GR|Το Nutricia Frutapura μια απαλή και γευστικότατη φρουτόκρεμα από 100% αγνά φρούτα, καλλιεργημένα και προσεκτικά επιλεγμένα από ειδικούς οπωρώνες.|https://www.ab.gr/medias/sys_master/h01/hb1/8926561140766.jpg|7
BΡΕΦΙΚΟ ΑΦΡΟΛΟΥΤΡΟ  300 ML|Χαρίζει ενυδάτωση στο δέρμα και καταπολεμά την ξηρότητα. Υποαλλεργικό, χωρίς σαπούνι, οινόπνευμα και χρωστικές, περιέχει χαμομήλι.|https://www.ab.gr/medias/sys_master/h58/hd1/8847614640158.jpg|7
ΒΡΕΦΙΚΗ ΠΟΥΔΡΑ ΣΩΜΑΤΟΣ  100 GR|Η παραδοσιακή πούδρα Fissan σε μορφή σκόνης προστατεύει αποτελεσματικά το δέρμα από ερεθισμούς. Απαραίτητη για την καθημερινή περιποίηση και φροντίδα κάθε ευαίσθητου δέρματος.|https://www.ab.gr/medias/sys_master/ha8/h9c/8839766409246.jpg|7
ΒΡΕΦΙΚΟ ΣΑΜΠΟΥΑΝ XAMOMHΛΙ 750 ML|Για απαλά, λαμπερά μαλλιά. Για απαλά μαλλιά. Η σύνθεση ΟΧΙ ΠΙΑ ΔΑΚΡΥΑ ® είναι απαλή για τα μάτια. Εμπλουτισμένο με εκχύλισμα χαμομηλιού, το οποίο βοηθά να διατηρηθεί το ανοιχτό χρώμα και η λάμψη των ξανθών μαλλιών. Ελεγμένο από οφθαλμίατρο.|https://www.ab.gr/medias/sys_master/h97/h31/8828721266718.jpg|7
ΓΑΛΑ ΒΡΕΦΙΚΟ ΣΕ ΣΚΟΝΗ ΓΙΑ ΝΗΠΙΑ ΑΠΟ 1+ ΕΤΩΝ 800 GR|"Από το 1ο έτος η Milupa προσφέρει το νηπιακό γάλα Milupa Aptamil Step Up 1+ σε σκόνη. Tο Αptamil Step Up 1+ της Μilupa συμβάλλει στην άριστη και υγιή ανάπτυξη του βρέφους με τη σύνθεση ""Ολοκληρωμένη Φροντίδα"" που εξασφαλίζει: Κατάλληλη ποσότητα πρωτεΐνης. Ασβέστιο & βιταμίνη D για την ανάπτυξη των οστών. Πρεβιοτικές ίνες."|https://www.ab.gr/medias/sys_master/hf1/h55/8829026205726.jpg|7
ΕΝΥΔΑΤΙΚΗ ΚΡΕΜΑ SLEEP EASY 150 ML|Χαλαρώνει και περιποιείται το μωρό σας. Ο ύπνος είναι πολύ σημαντικός για τα μωρά. Το Proderm Sleep Easy, εμπλουτισμένο με φυσικά εκχυλίσματα χαμομηλιού και λεβάντας, βοηθά το μωρό σας να χαλαρώσει και να κοιμηθεί καλύτερα. Η πλούσια υφή της ενυδατώνει και περιποιείται την επιδερμίδα αφήνοντάς την απαλή.|https://www.ab.gr/medias/sys_master/h77/h4c/8841278423070.jpg|7
ΣΑΜΠΟΥΑΝ ΚΑΙ ΑΦΡΟΛΟΥΤΡΟ 0 ΕΩΣ 12 ΜΗΝΩΝ 400 ML|Σαμπουάν & Αφρόλουτρο ειδικά σχεδιασμένο για μωρά έως 12 μηνών. Χάρη στην ειδική του σύνθεση, καθαρίζει υγιεινά το κεφαλάκι και το σώμα του μωρού.|https://www.ab.gr/medias/sys_master/hde/h85/8841143287838.jpg|7
ΣΑΜΠΟΥΑΝ ΚΑΙ ΑΦΡΟΛΟΥΤΡΟ NATURAL CARE 400 ML|Το σαμπουάν και αφρόλουτρο Natural Care είναι ειδικά σχεδιασμένο για την ευαίσθητη ξηρή βρεφική επιδερμίδα. Η μοναδική του σύνθεση περιέχει φυσικά εκχυλίσματα καλέντουλας, αλόης και αμυγδαλέλαιου, γνωστά για τις ενυδατικές και καταπραϋντικές τους ιδιότητες.|https://www.ab.gr/medias/sys_master/h46/h01/8841128345630.jpg|7
ΣΑΜΠΟΥΑΝ ΠΑΙΔΙΚΟ CLASSIC 750 ML||https://www.ab.gr/medias/sys_master/h74/h0f/8903775682590.jpg|7
BABY OIL BEDTIΜΕ ΛΕΒΑΝΤΑ 200 ML|Βοηθάει το μωρό να κοιμάται καλύτερα, όταν χρησιμοποιείται σαν μέρος καθημερινού προγράμματος. Κλινικά αποδεδειγμένο βραδινό πρόγραμμα, που βοηθάει το μωράκι σας να κοιμηθεί καλύτερα. Περιέχει NaturalCalm™, ένα μοναδικό μίγμα χαλαρωτικών αρωμάτων. Σφραγίζει 10 φορές περισσότερη υγρασία από ότι πολλές λοσιόν σε στεγνή επιδερμίδα.|https://www.ab.gr/medias/sys_master/h0f/h97/8905491513374.jpg|7
ΓΑΛΑ ΒΡΕΦΙΚΟ ΣΕ ΣΚΟΝΗ ΤΡΙΤΗΣ ΒΡΕΦΙΚΗΣ ΗΛΙΚΙΑΣ 800 GR|Το Aptamil 3 της Milupa είναι γάλα σε σκόνη για βρέφη μετά το 10ο μήνα. Συμβάλλει στην άριστη και υγιή ανάπτυξη των βρεφών με τη σύνθεση Ολοκληρωμένη Φροντίδα που εξασφαλίζει: Ασβέστιο & βιταμίνη DΑσβέστιο & βιταμίνη D για την ανάπτυξη των οστών, Ω3 λιπαρά οξέαΩ3 λιπαρά οξέα για την ανάπτυξη του εγκεφάλου και του νευρικού συστήματος, Πρεβιοτικές ίνες|https://www.ab.gr/medias/sys_master/h71/h54/8829013622814.jpg|7
ΕΝΥΔΑΤΙΚΗ ΚΡΕΜΑ  150 ML|Ειδικά σχεδιασμένη για μωρά έως 12 μηνών. Χάρη στην ειδική της σύνθεση απλώνεται αμέσως, χωρίς ίχνος λιπαρότητας, ενώ ενυδατώνει και αναζωογονεί την βρεφική επιδερμίδα.|https://www.ab.gr/medias/sys_master/hc9/h69/8841127755806.jpg|7
ΚΡΕΜΑ ΠΑΙΔΙΚΗ ΑΝΘΟΣ ΟΡΥΖΗΣ 150 GR|Tόσο πολύτιμο... όσο και η πρώτη του λεξούλα! To 'Ανθος Ορύζης είναι η πρώτη στερεά τροφή που μπαίνει στο διαιτολόγιο του μωρού σας. Ένα θρεπτικό και γευστικό συμπλήρωμα στο γάλα, την κρέμα, τις σούπες. Από επιλεγμένες ποιότητες ελληνικού ρυζιού. Tο ρύζι είναι η τροφή που δεν προκαλεί αλλεργικές αντιδράσεις. Tο 'Ανθος Oρύζης ΓIΩTHΣ σε συνδυασμό με τις βιταμίνες και τα μέταλλα που περιέχει, δίνει στο μωρό σας την πρώτη «δυνατή» γεύση από ενέργεια και δύναμη.|https://www.ab.gr/medias/sys_master/hf2/hb1/8833230340126.jpg|7
ΚΡΕΜΑ ΠΑΙΔΙΚΗ ΒΑΝΙΛΙΑ 300 GR|To μωρό σας μόλις έγινε 5 μηνών και θα ξεκινήσει τις πρώτες του στερεές τροφές! Αυτή την περίοδο το μωρό σας μπορεί να δείχνει πολύ πιο πεινασμένο από ότι συνήθως! Αυτό ίσως να σημαίνει ότι είναι έτοιμο να περάσει στις στερεές τροφές, να μεταβεί δηλαδή από μια διατροφή που στηρίζεται πλήρως στο γάλα σε ένα πρόγραμμα διατροφής που συμπεριλαμβάνει και στερεές τροφές. Η ένταξη των στερεών τροφών στο βρεφικό διαιτολόγιο συστήνεται να ξεκινά από τον 5ο - 6ο μήνα και σίγουρα όχι νωρίτερα από την 17η εβδομάδα. Η μετάβαση στις στερεές τροφές είναι ένα μεγάλο βήμα για εσάς και το μωρό σας, γι’ αυτό οι πρώτες του τροφές πρέπει να έχουν απαλή γεύση και εύπεπτη σύνθεση. Ξεκινήστε την εισαγωγή των στερεών τροφών με τη Nutricia κρέμα Βανίλια με ρυζάλευρο από 5 μηνών, με απαλή γεύση και υφή.|https://www.ab.gr/medias/sys_master/haa/hc0/8910706245662.jpg|7
ΚΡΕΜΑ ΠΑΙΔΙΚΗ ΜΠΙΣΚΟΤΟΚΡΕΜΑ 300 GR|Τώρα που το μωρό σας έγινε 6 μηνών χρειάζεται περισσότερη ποικιλία! Καθώς το μωρό σας μεγαλώνει είναι σημαντικό να προσθέτετε στη διατροφή του ποικιλία τροφών και γεύσεων. Με αυτό τον τρόπο μαθαίνει από μικρό την ποικιλία, που αποτελεί θεμέλιο για μια ισορροπημένη διατροφή. Οι βρεφικές κρέμες Nutricia από 6 μηνών είναι ειδικά μελετημένες για να καλύπτουν τις διατροφικές ανάγκες του μωρού σας στο στάδιο αυτό, έτσι ώστε να εξοικειώνεται με νέες γεύσεις.|https://www.ab.gr/medias/sys_master/h31/h74/8827132477470.jpg|7
ΠΑΝΕΣ ΒΡΑΚΑΚΙΑ 16 - 25 KGR No 6 18 ΤΕΜ|Πάνες βρακάκια Νο.6, Μέγεθος XL.|https://www.ab.gr/medias/sys_master/hf0/hda/8832210665502.jpg|7
ΠΑΝΕΣ ΜΩΡΟΥ SENSITIVE 7 - 18 KGR  No 4 20 ΤΕΜ|Οι βρεφικές πάνες Babylino Sensitive, χάρη στα ελαστικά πλαϊνά τους, που τεντώνονται όσο χρειάζεται, θα βοηθήσουν το μωράκι σας να νιώσει απόλυτη άνεση και ελευθερία κινήσεων σε αυτό το τόσο σημαντικό στάδιο όπου αρχίζει σιγά σιγά να στέκεται στα πόδια του και να κάνει τα πρώτα του βηματάκια. Παράλληλα, χάρη στο εκχύλισμα χαμομηλιού που περιέχουν και τα φιλικά στο δέρμα υλικά τους, πιστοποιημένα βάσει Oeko-Tex® Standard 100, μπορείτε να είστε σίγουροι ότι αγγίζουν το δερματάκι του μωρού σας με αποδεδειγμένα φιλικό τρόπο.|https://www.ab.gr/medias/sys_master/h44/hf3/8923022032926.jpg|7
BABY OIL ΧΑΜΟΜΗΛΙ 200 ML|Σφραγίζει 10 φορές περισσότερη υγρασία από ότι πολλές λοσιόν σε στεγνή επιδερμίδα. Για το μωρό και για εσάς. Καταπραΰνει, προστατεύει και ενυδατώνεI. Εμπλουτισμένο με χαμομήλι. Ιδανικό για μασάζ στο μωρό.|https://www.ab.gr/medias/sys_master/h8d/h85/8839793934366.jpg|7
ΑΦΡΟΛΟΥΤΡΟ GENTLE PROTECT 500 ML|Είναι ειδικά σχεδιασμένο ώστε πλένοντας να απομακρύνει αποτελεσματικά τη βρωμιά και τα μικρόβια, ενώ ταυτόχρονα είναι απαλό για την ευαίσθητη επιδερμίδα των παιδιών.|https://www.ab.gr/medias/sys_master/h4f/h83/8841132671006.jpg|7
ΒΡΕΦΙΚΟ ΓΑΛΑΚΤΩΜΑ ΕΝΥΔΑΤΩΣΗΣ  200 ML|CHICCO  ΒΡΕΦΙΚΟ ΓΑΛΑΚΤΩΜΑ ΕΝΥΔΑΤΩΣΗΣ  200 ML|https://www.ab.gr/medias/sys_master/h68/h22/8838355976222.jpg|7
